[
  {
    "id": "c-derivation-001",
    "chapter": "derivation",
    "title": "Calcul d'un nombre dérivé via la limite du taux de variation",
    "difficulty": 1,
    "estimatedMinutes": 8,
    "order": 10,
    "tags": [
      "nombre-derive",
      "taux-de-variation",
      "limite",
      "definition"
    ],
    "preamble": "On considère la fonction $f$ définie sur $\\mathbb{R}$ par $f(x) = x^2 + 3x$.",
    "questions": [
      {
        "id": "q1",
        "label": "1.",
        "statement": "Pour tout réel $h \\neq 0$, exprimer le taux de variation $\\tau(h) = \\dfrac{f(2 + h) - f(2)}{h}$ de $f$ entre $2$ et $2 + h$, puis simplifier.",
        "hints": [
          "Calcule d'abord $f(2)$ puis développe $f(2 + h)$ en utilisant $(2 + h)^2 = 4 + 4h + h^2$.",
          "Effectue la différence $f(2 + h) - f(2)$ : tu dois pouvoir factoriser $h$ au numérateur, puis simplifier par $h$.",
          "On obtient $\\tau(h) = h + 7$."
        ],
        "expectedAnswer": "$\\tau(h) = h + 7$",
        "solution": "On a $f(2) = 2^2 + 3 \\times 2 = 4 + 6 = 10$.\n\nDe plus :\n$$f(2 + h) = (2 + h)^2 + 3(2 + h) = 4 + 4h + h^2 + 6 + 3h = h^2 + 7h + 10.$$\n\nDonc :\n$$f(2 + h) - f(2) = (h^2 + 7h + 10) - 10 = h^2 + 7h = h(h + 7).$$\n\nAinsi, pour $h \\neq 0$ :\n$$\\tau(h) = \\dfrac{h(h + 7)}{h} = h + 7.$$"
      },
      {
        "id": "q2",
        "label": "2.",
        "statement": "En déduire le nombre dérivé $f'(2)$.",
        "hints": [
          "Le nombre dérivé $f'(2)$ est, par définition, la limite de $\\tau(h)$ quand $h$ tend vers $0$.",
          "Ici $\\tau(h) = h + 7$ : que devient cette expression lorsque $h$ tend vers $0$ ?",
          "$f'(2) = 7$."
        ],
        "expectedAnswer": "$f'(2) = 7$",
        "solution": "Par définition, $f'(2) = \\displaystyle\\lim_{h \\to 0} \\tau(h)$.\n\nOr, $\\tau(h) = h + 7$. Lorsque $h$ tend vers $0$, $h + 7$ tend vers $0 + 7 = 7$.\n\nDonc $f'(2) = 7$."
      }
    ]
  },
  {
    "id": "c-derivation-002",
    "chapter": "derivation",
    "title": "Équation de la tangente en un point donné",
    "difficulty": 1,
    "estimatedMinutes": 6,
    "order": 20,
    "tags": [
      "tangente",
      "equation"
    ],
    "preamble": "On considère la fonction $f$ définie sur $\\mathbb{R}$ par $f(x) = x^3 - 2x + 1$. On note $\\mathcal{C}_f$ sa courbe représentative.",
    "questions": [
      {
        "id": "q1",
        "label": "1.",
        "statement": "Déterminer une équation de la tangente $T$ à $\\mathcal{C}_f$ au point d'abscisse $a = 1$.",
        "hints": [
          "L'équation de la tangente en $a$ est $y = f'(a)(x - a) + f(a)$. Il faut donc calculer $f(1)$ et $f'(1)$.",
          "Calcule $f(1) = 1 - 2 + 1$ ; puis $f'(x) = 3x^2 - 2$ et $f'(1) = 3 - 2 = 1$. Remplace dans la formule avec $a = 1$.",
          "$y = 1 \\times (x - 1) + 0 = x - 1$."
        ],
        "expectedAnswer": "$y = x - 1$",
        "solution": "L'équation de la tangente à $\\mathcal{C}_f$ au point d'abscisse $a$ est $y = f'(a)(x - a) + f(a)$.\n\n**Calcul de $f(1)$** : $f(1) = 1^3 - 2 \\times 1 + 1 = 1 - 2 + 1 = 0$.\n\n**Calcul de $f'(x)$** : la fonction $f$ est dérivable sur $\\mathbb{R}$ comme fonction polynôme, et $f'(x) = 3x^2 - 2$. Donc $f'(1) = 3 - 2 = 1$.\n\nAinsi, $T$ a pour équation $y = 1 \\times (x - 1) + 0$, soit $\\boxed{y = x - 1}$."
      }
    ]
  },
  {
    "id": "c-derivation-003",
    "chapter": "derivation",
    "title": "Tangente horizontale et tangente de pente donnée",
    "difficulty": 2,
    "estimatedMinutes": 10,
    "order": 30,
    "tags": [
      "tangente",
      "horizontale",
      "equation"
    ],
    "preamble": "Soit $f$ la fonction définie sur $\\mathbb{R}$ par $f(x) = x^2 - 6x + 5$.",
    "questions": [
      {
        "id": "q1",
        "label": "1.",
        "statement": "Déterminer l'abscisse du point de la courbe $\\mathcal{C}_f$ en lequel la tangente est horizontale.",
        "hints": [
          "Une tangente est horizontale lorsque son coefficient directeur est nul, c'est-à-dire $f'(a) = 0$.",
          "Calcule $f'(x) = 2x - 6$, puis résous $f'(a) = 0$.",
          "On trouve $a = 3$."
        ],
        "expectedAnswer": "$a = 3$",
        "solution": "La tangente à $\\mathcal{C}_f$ au point d'abscisse $a$ a pour coefficient directeur $f'(a)$. Elle est horizontale si et seulement si $f'(a) = 0$.\n\nLa fonction $f$ est dérivable sur $\\mathbb{R}$ et $f'(x) = 2x - 6$.\n\nOn résout $2a - 6 = 0$, soit $a = 3$.\n\nAinsi, la tangente est horizontale au point d'abscisse $a = 3$ (soit au point $(3 \\, ; \\, f(3)) = (3 \\, ; \\, -4)$)."
      },
      {
        "id": "q2",
        "label": "2.",
        "statement": "Déterminer l'abscisse du point de $\\mathcal{C}_f$ en lequel la tangente a pour coefficient directeur $4$.",
        "hints": [
          "On cherche $a$ tel que $f'(a) = 4$.",
          "Avec $f'(x) = 2x - 6$, résous $2a - 6 = 4$.",
          "$a = 5$."
        ],
        "expectedAnswer": "$a = 5$",
        "solution": "On cherche $a$ tel que $f'(a) = 4$.\n\nOn a $f'(x) = 2x - 6$, donc l'équation $f'(a) = 4$ s'écrit :\n$$2a - 6 = 4 \\iff 2a = 10 \\iff a = 5.$$\n\nAinsi, la tangente a pour coefficient directeur $4$ au point d'abscisse $a = 5$."
      }
    ]
  },
  {
    "id": "c-derivation-004",
    "chapter": "derivation",
    "title": "Dérivée d'une fonction polynôme",
    "difficulty": 1,
    "estimatedMinutes": 6,
    "order": 40,
    "tags": [
      "polynome",
      "derivee",
      "linearite"
    ],
    "preamble": "On considère la fonction $f$ définie sur $\\mathbb{R}$ par $f(x) = 2x^4 - 5x^3 + x^2 - 7x + 9$.",
    "questions": [
      {
        "id": "q1",
        "label": "1.",
        "statement": "Justifier que $f$ est dérivable sur $\\mathbb{R}$ et déterminer sa fonction dérivée $f'$.",
        "hints": [
          "Une fonction polynôme est dérivable sur $\\mathbb{R}$. Pour la dérivée, applique la linéarité et la formule $(x^n)' = n\\,x^{n-1}$ à chaque terme.",
          "Dérive terme à terme : $(2x^4)' = 8x^3$, $(-5x^3)' = -15x^2$, $(x^2)' = 2x$, $(-7x)' = -7$, $(9)' = 0$.",
          "$f'(x) = 8x^3 - 15x^2 + 2x - 7$."
        ],
        "expectedAnswer": "$f'(x) = 8x^3 - 15x^2 + 2x - 7$",
        "solution": "La fonction $f$ est une fonction polynôme, donc elle est dérivable sur $\\mathbb{R}$.\n\nPar linéarité de la dérivation et avec la formule $(x^n)' = n\\,x^{n-1}$, on obtient terme à terme :\n\n$$f'(x) = 2 \\times 4x^3 - 5 \\times 3x^2 + 2x - 7 + 0,$$\n\nsoit pour tout $x \\in \\mathbb{R}$ :\n$$\\boxed{f'(x) = 8x^3 - 15x^2 + 2x - 7}.$$"
      }
    ]
  },
  {
    "id": "c-derivation-005",
    "chapter": "derivation",
    "title": "Dérivée d'un produit",
    "difficulty": 2,
    "estimatedMinutes": 8,
    "order": 50,
    "tags": [
      "produit",
      "operations"
    ],
    "preamble": "Soit $f$ la fonction définie sur $\\mathbb{R}$ par $f(x) = (3x - 1)(x^2 + 4)$.",
    "questions": [
      {
        "id": "q1",
        "label": "1.",
        "statement": "Calculer $f'(x)$ en utilisant la formule de dérivation d'un produit.",
        "hints": [
          "Pose $u(x) = 3x - 1$ et $v(x) = x^2 + 4$, calcule $u'$ et $v'$, puis applique $(uv)' = u'v + uv'$.",
          "Ici $u'(x) = 3$ et $v'(x) = 2x$. Donc $f'(x) = 3(x^2 + 4) + (3x - 1) \\times 2x$.",
          "Après développement : $f'(x) = 9x^2 - 2x + 12$."
        ],
        "expectedAnswer": "$f'(x) = 9x^2 - 2x + 12$",
        "solution": "On pose $u(x) = 3x - 1$ et $v(x) = x^2 + 4$. Les fonctions $u$ et $v$ sont dérivables sur $\\mathbb{R}$ (polynômes), donc $f = uv$ l'est aussi.\n\nOn a $u'(x) = 3$ et $v'(x) = 2x$. D'après la formule $(uv)' = u'v + uv'$ :\n\n$$f'(x) = 3 \\times (x^2 + 4) + (3x - 1) \\times 2x.$$\n\nOn développe :\n$$f'(x) = 3x^2 + 12 + 6x^2 - 2x = 9x^2 - 2x + 12.$$\n\nDonc, pour tout $x \\in \\mathbb{R}$, $f'(x) = 9x^2 - 2x + 12$."
      }
    ]
  },
  {
    "id": "c-derivation-006",
    "chapter": "derivation",
    "title": "Dérivée d'un quotient",
    "difficulty": 2,
    "estimatedMinutes": 9,
    "order": 60,
    "tags": [
      "quotient",
      "operations"
    ],
    "preamble": "On considère la fonction $f$ définie sur $\\mathbb{R} \\setminus \\{1\\}$ par $f(x) = \\dfrac{2x + 3}{x - 1}$.",
    "questions": [
      {
        "id": "q1",
        "label": "1.",
        "statement": "Justifier que $f$ est dérivable sur $\\mathbb{R} \\setminus \\{1\\}$, puis calculer $f'(x)$ et simplifier.",
        "hints": [
          "Pose $u(x) = 2x + 3$ et $v(x) = x - 1$. Le dénominateur $v$ ne s'annule pas sur $\\mathbb{R} \\setminus \\{1\\}$, donc $f = u/v$ y est dérivable.",
          "Applique la formule $\\left(\\dfrac{u}{v}\\right)' = \\dfrac{u'v - uv'}{v^2}$ avec $u'(x) = 2$ et $v'(x) = 1$.",
          "On obtient $f'(x) = \\dfrac{2(x - 1) - (2x + 3) \\times 1}{(x - 1)^2} = \\dfrac{-5}{(x - 1)^2}$."
        ],
        "expectedAnswer": "$f'(x) = \\dfrac{-5}{(x - 1)^2}$",
        "solution": "On pose $u(x) = 2x + 3$ et $v(x) = x - 1$. Les fonctions $u$ et $v$ sont dérivables sur $\\mathbb{R}$, et $v$ ne s'annule pas sur $\\mathbb{R} \\setminus \\{1\\}$. Donc $f = \\dfrac{u}{v}$ est dérivable sur $\\mathbb{R} \\setminus \\{1\\}$.\n\nOn a $u'(x) = 2$ et $v'(x) = 1$. D'après la formule du quotient :\n$$f'(x) = \\dfrac{u'(x) v(x) - u(x) v'(x)}{[v(x)]^2} = \\dfrac{2(x - 1) - (2x + 3) \\times 1}{(x - 1)^2}.$$\n\nOn développe le numérateur :\n$$2(x - 1) - (2x + 3) = 2x - 2 - 2x - 3 = -5.$$\n\nAinsi, pour tout $x \\in \\mathbb{R} \\setminus \\{1\\}$ :\n$$\\boxed{f'(x) = \\dfrac{-5}{(x - 1)^2}}.$$"
      }
    ]
  },
  {
    "id": "c-derivation-007",
    "chapter": "derivation",
    "title": "Dérivée d'une fonction de la forme $u(ax + b)$",
    "difficulty": 2,
    "estimatedMinutes": 9,
    "order": 70,
    "tags": [
      "composee-affine",
      "operations"
    ],
    "preamble": "On considère la fonction $f$ définie sur $\\mathbb{R}$ par $f(x) = (2x - 5)^4$.",
    "questions": [
      {
        "id": "q1",
        "label": "1.",